{
  "schema_version": "1.0",
  "model_call_receipt_id": "mcr_planner0001",
  "workspace_id": "ws_stage0001",
  "case_id": "case_stage0001",
  "attempt_snapshot": {
    "kind": "ATTEMPT",
    "id": "att_planner0001",
    "revision": 1,
    "digest": "sha256:c3a240100d282b75c3158522a65dd7dfa94346b7d449d671e876cacfc2bd5b5b"
  },
  "executor_principal": "prn_planner0001",
  "agent_manifest": {
    "kind": "AGENT_MANIFEST",
    "id": "aman_planner001",
    "revision": 1,
    "digest": "sha256:7e9929e0c3cc77658d513326e7fbc3fd4420eeeeb186430d885c4f5e5e24b0f9"
  },
  "runtime_session_id": "claude-session-planner",
  "requested_model": "glm-5.2",
  "resolved_provider": "zhipu",
  "resolved_model": "glm-5.2",
  "model_resolution_receipt_digest": "sha256:7663c2a13920493a5087da13c136863d3fe39d6346408a723d9b570e6bdbce08",
  "provider_provenance": {
    "protocol": "GLM_NATIVE",
    "provider_org": "zhipu-ai",
    "endpoint_origin": "https://open.bigmodel.cn",
    "account_project": {
      "account_ref": "provider-account://zhipu/caseloop",
      "project_ref": "provider-project://zhipu/stage0"
    },
    "credential_ref": "credential://zhipu/stage0/replay",
    "model_family": "glm-5",
    "provider_request_id": "req-planner-0001",
    "returned_model": "glm-5.2",
    "http_status": 200,
    "finish_reason": "stop",
    "token_usage": {
      "input_tokens": 100,
      "output_tokens": 50,
      "total_tokens": 150
    },
    "raw_retained": false,
    "call_mode": "REPLAY"
  },
  "independence_basis": {
    "provider_org": "zhipu-ai",
    "endpoint_origin": "https://open.bigmodel.cn",
    "account_project": {
      "account_ref": "provider-account://zhipu/caseloop",
      "project_ref": "provider-project://zhipu/stage0"
    },
    "credential_ref": "credential://zhipu/stage0/replay",
    "model_family": "glm-5"
  },
  "independence_key": "sha256:a137a8c2920bba78d50dde172125a9393fc62e2a4cb04a7bc052b0bcd1570972",
  "request_digest": "sha256:09238fb7ef9fbad441b0ed5584a1b701169d83a8e6855e828dd90995cd13b416",
  "response_digest": "sha256:e5409f8c57deb338aa2b634a8f398f6ab3823332010be77ae3ac3737f5bd4081",
  "usage_digest": "sha256:0e63335f73be3fdbe9a106896545d4e5605c91631ddb386b3e1020a3e27c2db2",
  "outcome": "SUCCEEDED",
  "started_at": "2026-08-10T00:51:00Z",
  "completed_at": "2026-08-10T00:54:00Z",
  "recorded_at": "2026-08-10T00:54:00Z",
  "authority_receipt_id": "arec_modelcallplanner00000000",
  "immutable": true,
  "hash_rule": "jcs-rfc8785-v1+sha256(excluding:/model_call_receipt_digest)",
  "model_call_receipt_digest": "sha256:c4ad3336b3a9e04f26f48cee98ccc04a61cf2fc278d2e9c1424683cb460f75dc"
}
